headline,url,datePublished
Мацут: Први смо у региону по утицају жена у политичком животу,https://www.rts.rs/vesti/politika/5795996/macut-djuro-zene-vlada-srbija.html,"уторак, 30. сеп 2025, 11:56 -> 19:50"
"Мали: Ванредно повећање зарада у просвети и здравству, никад већи раст минималца",https://www.rts.rs/vesti/politika/5795855/povecanje-plate-minimalac-sinisa-mali-mere-budzet-nis-sankcije.html,"уторак, 30. сеп 2025, 08:45 -> 08:49"
Амбасадор Ли: 70 година међусобног разумевања; Вучић: Поверење градимо кроз конкретне пројекте,https://www.rts.rs/vesti/politika/5795807/ambasador-li-vucic-prijem-kina.html,"понедељак, 29. сеп 2025, 20:05 -> 21:07"
Вучић са Боцан-Харченком: Размотрили смо ситуацију у вези са НИС-ом,https://www.rts.rs/vesti/politika/5795788/vucic-bocan-harcenko-nis-.html,"понедељак, 29. сеп 2025, 19:11 -> 19:20"
Протести у Чачку и Београду,https://www.rts.rs/vesti/politika/5795783/protesti-u-cacku-i-beogradu.html,"понедељак, 29. сеп 2025, 18:58 -> 22:23"
"Прва међународна конференција о БРИКС-у у Србији – Вулин: За разлику од ЕУ, БРИКС не поставља ултиматуме ",https://www.rts.rs/vesti/politika/5795750/prva-medjunarodna-konferencija-o-briks-u-u-srbiji--vulin-za-razliku-od-eu-briks-ne-postavlja-ultimatume-.html,"понедељак, 29. сеп 2025, 17:28 -> 18:28"
"Приштина, настављено суђење бившем полицајцу Шаћиру Лутвији",https://www.rts.rs/vesti/politika/5795417/sacir-lutvija-sudjenje.html,"понедељак, 29. сеп 2025, 12:53 -> 13:08"
"Вучевић: Руководство РТС-а изгубило легитимитет, требало би да поднесу оставке",https://www.rts.rs/vesti/politika/5795299/vucevic-rukovodstvo-rts-a-izgubilo-legitimitet-trebalo-bi-da-podnesu-ostavke.html,"понедељак, 29. сеп 2025, 11:17 -> 11:37"
"Радојевић: Србима на КиМ ускраћен јавни живот, избори кључни за ослобађање наших општина ",https://www.rts.rs/vesti/politika/5795201/kosovo-metohija-kim-izbori-srpska-lista-milan-radojevic-mitrovica.html,"понедељак, 29. сеп 2025, 08:50 -> 08:58"
МСП: Изјаве амбасадора Лагумџије директно мешање у суверену спољну политику Србије,https://www.rts.rs/vesti/politika/5795132/ministarstvo-spoljnih-sposlova-lagumdzija.html,"недеља, 28. сеп 2025, 20:32 -> 20:55"
"Вучић: Народ био жртва блокада и малтретирања, успели смо да превазиђемо најтеже време",https://www.rts.rs/vesti/politika/5795056/aleksandar-vucic-obrenovac.html,"недеља, 28. сеп 2025, 18:01 -> 19:47"
"Скупови грађана против блокада на 167 локација у Србији, окупљени испред РТС-а упутили три захтева",https://www.rts.rs/vesti/politika/5795034/okupljanja-protiv-blokada-sns-takovska-rts-vucic.html,"недеља, 28. сеп 2025, 17:24 -> 21:09"
Тензије и инциденти између грађана који су за и који су против блокада,https://www.rts.rs/vesti/politika/5794994/tenzije-i-incidenti-izmedju-gradjana-koji-su-za-i-koji-su-protiv-blokada.html,"недеља, 28. сеп 2025, 14:25 -> 23:07"
"Вучић: Не верујем да БНД финансира протесте, чудно што су им лидери немачки стипендисти",https://www.rts.rs/vesti/politika/5794943/aleksandar-vucic-intervju-faz.html,"недеља, 28. сеп 2025, 10:21 -> 10:30"
"Подељени ставови на Генералној скупштини УН – Трамп оштро у Њујорку, Вучић позвао на дијалог",https://www.rts.rs/vesti/politika/5794910/sednica-un-dijalog-vucic-tramop-rubio-nis-sankcije.html,"недеља, 28. сеп 2025, 08:50 -> 08:50"
"Нови систем уласка у ЕУ од октобра – биометрија, израда профила и прелаз без печата",https://www.rts.rs/vesti/politika/5794799/eu-granice-pasosi-prelazi.html,"недеља, 28. сеп 2025, 06:00 -> 07:39"
Лавров у УН: Запад крши права Срба и на Косову и Метохији и у БиХ,https://www.rts.rs/vesti/politika/5794808/lavrov.html,"субота, 27. сеп 2025, 19:07 -> 23:53"
"Вучић за Њузмакс: Следеће године ће бити највише сукоба икада, морамо да се вратимо дијалогу",https://www.rts.rs/vesti/politika/5794755/vucic-za-njuzmaks-sledece-godine-ce-biti-najvise-sukoba-ikada-moramo-da-se-vratimo-dijalogu.html,"субота, 27. сеп 2025, 16:53 -> 19:46"
Американци померили санкције НИС-у за још осам дана,https://www.rts.rs/vesti/politika/5794632/amerikanci-pomerili-sankcije-nis-u-za-jos-osam-dana.html,"петак, 26. сеп 2025, 23:37 -> 15:37"
Ђурић у Њујорку домаћин министарског ручка поводом председавања Србије Централно-европској иницијативи,https://www.rts.rs/vesti/politika/5794627/djuric-u-njujorku-domacin-ministarskog-rucka-povodom-predsedavanja-srbije-centralno-evropskoj-inicijativi.html,"петак, 26. сеп 2025, 23:21 -> 23:37"
"Вучић за РТС: Шта год да урадимо наиђете са сваке стране на зид, не верујем да ће САД изаћи у сусрет у вези са НИС-ом",https://www.rts.rs/vesti/politika/5794516/aleksandar-vucic-njujork-generalna-skupstina-ujedinjenih-nacija-gs-un.html,"петак, 26. сеп 2025, 19:35 -> 21:49"
Влада усвојила предлог закона о  легализацији објеката - које могућности грађани добијају,https://www.rts.rs/vesti/politika/5794487/vlada-usvojila-predlog-zakona-o-legalizaciji-objekata---koje-mogucnosti-gradjani-dobijaju.html,"петак, 26. сеп 2025, 17:56 -> 19:19"
Мацут у Бањалуци: Континуитет сарадње између две владе даје конкретне резултате,https://www.rts.rs/vesti/politika/5794425/djuro-macut-savo-minic-banjaluka-saradnja.html,"петак, 26. сеп 2025, 16:17 -> 16:48"
"Мацут за РТС: Вишедеценијска прича о легализацији предлогом закона добија фасцинантан епилог; неки министри успавани, разговараћу са свима",https://www.rts.rs/vesti/politika/5794044/macut-za-rts-visedecenijska-prica-o-legalizaciji-predlogom-zakona-dobija-fascinantan-epilog-neki-ministri-uspavani-razgovaracu-sa-svima.html,"петак, 26. сеп 2025, 08:25 -> 12:29"
Вучић после састанака са европским и регионалним лидерима: Србија уважена и препознатљива свуда,https://www.rts.rs/vesti/politika/5794038/aleksandar-vucic-sastanak-evropa-region-srbija-hrvatska-grcka-.html,"петак, 26. сеп 2025, 07:50 -> 07:58"
Вучић са Нетанјахуом у Њујорку о споразуму о слободној трговини између Србије и Израела,https://www.rts.rs/vesti/politika/5793978/vucic-netanjahu-srbija-izrael.html,"петак, 26. сеп 2025, 06:08 -> 06:44"
Протест у Зајечару,https://www.rts.rs/vesti/politika/5793950/zajecar-protest-opozicija.html,"четвртак, 25. сеп 2025, 22:27 -> 22:40"
Вучић: САД уводе санкције НИС-у од 1. октобра,https://www.rts.rs/vesti/politika/5793820/sankcije-nis-vucic-aleksandar-njujork-amerika-sad.html,"четвртак, 25. сеп 2025, 19:21 -> 20:03"
"Мацут на Крфу: Све за Србију, Србију ни за шта",https://www.rts.rs/vesti/politika/5793779/macut-na-krfu-sve-za-srbiju-srbiju-ni-za-sta.html,"четвртак, 25. сеп 2025, 17:48 -> 21:52"
Председник Вучић се састао са генералним секретаром УН Гутересом,https://www.rts.rs/vesti/politika/5793763/aleksandar-vucic-un-njujork-guteres.html,"четвртак, 25. сеп 2025, 17:15 -> 19:52"
Окончана блокада зграде Ректората у Крагујевцу,https://www.rts.rs/vesti/politika/5793743/rektorat-blokada-studenti-kragujevac.html,"четвртак, 25. сеп 2025, 16:42 -> 18:38"
Кластер 3 – покретна мета или зачарани круг,https://www.rts.rs/vesti/politika/5793352/klaster-tri-otvaranje.html,"четвртак, 25. сеп 2025, 14:00 -> 14:14"
На Крфу обележена годишњица искрцавања српске војске; Мацут: Односи са Грчком у успону и након 109 година,https://www.rts.rs/vesti/politika/5793526/djuro-macut-srbija-grcka.html,"четвртак, 25. сеп 2025, 12:33 -> 16:59"
Тамара Вучић гошћа Олене Зеленске у Њујорку: Наши гласови снажно оружје у одбрани мира,https://www.rts.rs/vesti/politika/5793398/tamara-vucic-njujork-olena-zelenska.html,"четвртак, 25. сеп 2025, 10:32 -> 10:40"
Забрањено емитовање предизборног спота Српске листе,https://www.rts.rs/vesti/politika/5793388/zabranjeno-emitovanje-predizbornog-spota-srpske-liste.html,"четвртак, 25. сеп 2025, 10:29 -> 10:50"
Група студената покушала да спречи улазак запослених у Ректорат Универзитета у Крагујевцу,https://www.rts.rs/vesti/politika/5793336/grupa-studenata-pokusala-da-spreci-ulazak-zaposlenih-u-rektorat-univerziteta-u-kragujevcu.html,"четвртак, 25. сеп 2025, 09:36 -> 13:09"
Ђурић са Лавровом у Њујорку: Србија опредељена за јачање сарадње са Русијом,https://www.rts.rs/vesti/politika/5793318/djuric-sa-lavrovom-u-njujorku-srbija-opredeljena-za-jacanje-saradnje-sa-rusijom.html,"четвртак, 25. сеп 2025, 09:06 -> 09:34"
Дијаспора и ове године указује на тежак живот Срба на КиМ током заседања УН у Њујорку,https://www.rts.rs/vesti/politika/5793183/dijaspora-njujork-ujedinjene-nacije-kosovo-metohija-kim.html,"среда, 24. сеп 2025, 22:03 -> 00:37"
Сусрети председника Вучића са светским званичницима у Њујорку,https://www.rts.rs/vesti/politika/5793144/vucic-sastanci-njujork-generalna-skupstina-un.html,"среда, 24. сеп 2025, 21:02 -> 22:00"
Ђурић: Османијева се ,https://www.rts.rs/vesti/politika/5793116/srbija-djuric-nota-ujedinjene-nacije.html,"среда, 24. сеп 2025, 19:40 -> 20:09"
"Вучић: Разговор око санкција НИС-у нимало лак, не знамо каква ће одлука бити",https://www.rts.rs/vesti/politika/5793092/aleksandar-vucic-nis-sankcije.html,"среда, 24. сеп 2025, 19:15 -> 22:35"
Председник Вучић на Генералној скупштини УН: Србија ће остати слободна и независна; УН немају алтернативу; нудим Београд за место дијалога у светским сукобима,https://www.rts.rs/vesti/politika/5793052/aleksandar-vucic-obracanje-ujedinjene-nacije-generalna-skupstina-un-njujork-samit-govor.html,"среда, 24. сеп 2025, 18:10 -> 19:33"
"Министар просвете: До краја септембра стиже 492 милиона динара, друга рата за материјалне трошкове факултета",https://www.rts.rs/vesti/politika/5793058/ministarstvo-prosvete-492-miliona-druga-rata-troskovi-fakulteta.html,"среда, 24. сеп 2025, 17:17 -> 17:59"
Министарство просвете: Циљ свих мера и напора је да ,https://www.rts.rs/vesti/politika/5793062/vazduhoplovna-akademija-ministarstvo-prosvete.html,"среда, 24. сеп 2025, 17:17 -> 18:00"
Председник Вучић се после подне обраћа на Генералној скупштини УН,https://www.rts.rs/vesti/politika/5792907/predsednik-vucic-se-posle-podne-obraca-na-generalnoj-skupstini-un.html,"среда, 24. сеп 2025, 13:14 -> 13:56"
"Декани Универзитета у Крагујевцу уз ректора, скуп подршке студентима ФИЛУМ-а у блокади",https://www.rts.rs/vesti/politika/5792861/dekani-univerziteta-u-kragujevcu-uz-rektora-skup-podrske-studentima-filum-a-u-blokadi.html,"среда, 24. сеп 2025, 12:41 -> 00:54"
Ана Брнабић у Бакуу: Захвални смо Азербејџану на поштовању територијалног интегритета Србије,https://www.rts.rs/vesti/politika/5792852/ana-brnabic-u-bakuu-zahvalni-smo-azerbejdzanu-na-postovanju-teritorijalnog-integriteta-srbije.html,"среда, 24. сеп 2025, 12:19 -> 16:37"
"Изабран градоначелник Зајечара и председник Скупштине града, седницу обележили инциденти",https://www.rts.rs/vesti/politika/5792740/izabran-gradonacelnik-zajecara-i-predsednik-skupstine-grada-sednicu-obelezili-incidenti.html,"среда, 24. сеп 2025, 10:37 -> 15:23"
Ђурић и Сијарто у Њујорку о јачању веза Србије и Мађарске,https://www.rts.rs/vesti/politika/5792655/marko-djuric-sijarto-njujork.html,"среда, 24. сеп 2025, 09:33 -> 09:48"
 Мијачић: Ниједан споразум не предвиђа интеграцију српског здравства и школства у систем такозваног Косова,https://www.rts.rs/vesti/politika/5792645/-mijacic-nijedan-sporazum-ne-predvidja-integraciju-srpskog-zdravstva-i-skolstva-u-sistem-takozvanog-kosova.html,"среда, 24. сеп 2025, 09:32 -> 11:37"
Вучић са Рубијом у Њујорку: Важан разговор о јачању политичког дијалога Србије и САД,https://www.rts.rs/vesti/politika/5792616/vucic-sa-rubijom-u-njujorku-vazan-razgovor-o-jacanju-politickog-dijaloga-srbije-i-sad.html,"среда, 24. сеп 2025, 06:13 -> 09:25"
У Народном позоришту отворени ,https://www.rts.rs/vesti/politika/5792604/u-narodnom-pozoristu-otvoreni-dani-srpske-u-srbiji.html,"уторак, 23. сеп 2025, 23:06 -> 23:16"
Таковска 10: Врело лето најавило варљиву политичку јесен – када ће бити избори,https://www.rts.rs/vesti/politika/5792575/takovska-10-protesti-izbori-blokade-stojiljkovic-pejic-klacar.html,"уторак, 23. сеп 2025, 23:00 -> 23:54"
Ђурић: Изјаве Османи  у супротности са политиком САД,https://www.rts.rs/vesti/politika/5792506/djuric-izjave-osmani-u-suprotnosti-sa-politikom-sad.html,"уторак, 23. сеп 2025, 16:50 -> 17:16"
"Одаловић: Трага се за 1.590 несталих на КиМ, Приштина блокира процес",https://www.rts.rs/vesti/politika/5792475/nestali-kim-odalovic.html,"уторак, 23. сеп 2025, 15:47 -> 17:22"
"Вучић на пријему код генералног секретара УН, низ билатералних сусрета са светским званичницима",https://www.rts.rs/vesti/politika/5792438/vucic-njujork-generalna-skupstina.html,"уторак, 23. сеп 2025, 15:06 -> 17:56"
Управа за извршење кривичних санкција саопштила да је притворени студент прекинуо штрајк глађу,https://www.rts.rs/vesti/politika/5792389/uprava-za-izvrsenje-krivicnih-sankcija-saopstila-da-je-pritvoreni-student-prekinuo-strajk-gladju.html,"уторак, 23. сеп 2025, 14:19 -> 14:26"
"Почиње 80. заседање Генералне скупштине УН, делегацију Србије предводи председник Вучић",https://www.rts.rs/vesti/politika/5792005/pocinje-80-zasedanje-generalne-skupstine-un-delegaciju-srbije-predvodi-predsednik-vucic.html,"уторак, 23. сеп 2025, 08:30 -> 10:14"
"Двоструки аршини Приштине – каменовање аутобуса са Србима без казне, a затвор због слике на мајици",https://www.rts.rs/vesti/politika/5791718/kosovo-i-metohija.html,"понедељак, 22. сеп 2025, 19:35 -> 20:09"
"Вучић на заседању Генералне скупштине Уједињених нација, обраћа се у среду",https://www.rts.rs/vesti/politika/5791736/vucic-generalna-skupstina-un-njujork.html,"понедељак, 22. сеп 2025, 19:05 -> 19:48"
"Потези Приштине као увертира за оно што следи, Срби страхују да су на реду образовање и здравство",https://www.rts.rs/vesti/politika/5791328/ognjen-gogic-kosovo-metohija-upad-bolnice-izbori-kurti-kbc-dokumenta.html,"понедељак, 22. сеп 2025, 09:30 -> 09:44"
Министарка Софронијевић:  Порука  закона о легализацији – нулта толеранција на нову бесправну градњу,https://www.rts.rs/vesti/politika/5791323/ministarka-sofronijevic-poruka-zakona-o-legalizaciji--nulta-tolerancija-na-novu-bespravnu-gradnju.html,"понедељак, 22. сеп 2025, 07:26 -> 09:45"
"Каменован аутобус испред цркве у јужном делу Косовске Митровице, нападач ухапшен па пуштен",https://www.rts.rs/vesti/politika/5791261/kosovo-juzna-mitrovica-incident.html,"недеља, 21. сеп 2025, 21:26 -> 21:59"
Начелник Генералштаба Милан Мојсиловић са делегацијом Кине,https://www.rts.rs/vesti/politika/5791218/nacelnik-generalstaba-milan-mojsilovic-sa-delegacijom-kine.html,"недеља, 21. сеп 2025, 19:03 -> 19:09"
Протести подршке студентима у блокади у Новом Саду и Београду,https://www.rts.rs/vesti/politika/5791199/studentske-blokade-i-protesti.html,"недеља, 21. сеп 2025, 18:03 -> 19:28"
Вучић најавио закон ,https://www.rts.rs/vesti/politika/5791104/vucic-najavio-zakon-svoj-na-svome---legalizacija-48-miliona-objekata---za-70-odsto-njih-kostace-100-evra-povecanje-penzija-za-122-odsto.html,"недеља, 21. сеп 2025, 10:05 -> 14:11"
"Старовић: Не прети нам непосредна опасност од спољне агресије, нема стабилности без адекватне војне моћи",https://www.rts.rs/vesti/politika/5791079/nemanja-starovic-vojna-parada-snaga-jedinstva.html,"недеља, 21. сеп 2025, 09:05 -> 09:51"
Вучић се у 10 сати обраћа јавности поводом нових мера државе,https://www.rts.rs/vesti/politika/5791062/vucic-nove-mere-obracanje.html,"недеља, 21. сеп 2025, 06:09 -> 06:20"
Седница Савета за сарадњу Србије и Српске - Вучић: Парадом смо показали снагу и моћ; Додик: Србија не може бити лак плен,https://www.rts.rs/vesti/politika/5790969/sednica-saveta-za-saradnju-srbije-i-srpske---vucic-paradom-smo-pokazali-snagu-i-moc-dodik-srbija-ne-moze-biti-lak-plen.html,"субота, 20. сеп 2025, 16:15 -> 18:40"
"Уручена одликовања поводом Дана српског јединства, слободе и националне заставе",https://www.rts.rs/vesti/politika/5790833/predsednik-vucic-urucuje-odlikovanja-dan-srpskog-jedinstva-slobode-i-nacionalne-zastave.html,"субота, 20. сеп 2025, 14:11 -> 17:19"
Скуп студената у блокади на Новом Београду поводом војне параде ,https://www.rts.rs/vesti/politika/5790861/skup-studenata-u-blokadi-novi-beograd-.html,"субота, 20. сеп 2025, 10:50 -> 13:50"
Вучић угостио Бин Заједа: Посебно сам захвалан што ће бити гост на војној паради,https://www.rts.rs/vesti/politika/5790773/vucic-bin-zajed.html,"петак, 19. сеп 2025, 23:10 -> 23:45"
Министар Гашић са министром одбране Мађарске о војној сарадњи и паради ,https://www.rts.rs/vesti/politika/5790764/ministar-gasic-sa-ministrom-odbrane-madjarske-o-vojnoj-saradnji-i-paradi-snaga-jedinstva.html,"петак, 19. сеп 2025, 22:28 -> 22:36"
"Седница Скупштине Београда – усвојена 31 тачка дневног реда, акценат на урбанистичким плановима ",https://www.rts.rs/vesti/politika/5790704/skupstina-grada-beograda.html,"петак, 19. сеп 2025, 18:35 -> 21:36"
Виши суд у Новом Саду одбио жалбу и продужио притвор Богдану Јовичићу,https://www.rts.rs/vesti/politika/5790665/visi-sud-u-novom-sadu-odbio-zalbu-i-produzio-pritvor-bogdanu-jovicicu.html,"петак, 19. сеп 2025, 16:42 -> 20:42"
У Новом Саду и Ужицу скупови подршке студентима Богдану Јовичићу и Павлу Цицварићу,https://www.rts.rs/vesti/politika/5790526/u-novom-sadu-i-uzicu-skupovi-podrske-studentima-bogdanu-jovicicu-i-pavlu-cicvaricu.html,"петак, 19. сеп 2025, 14:34 -> 22:40"
"Лончар: Куртијеви упади са дугим цевима угрожавају наше здравство на КиМ, обавештени Вархељи и СЗО",https://www.rts.rs/vesti/politika/5790513/loncar-upad-kosovska-mitrovica.html,"петак, 19. сеп 2025, 12:22 -> 12:46"
Вучић са одлазећим амбасадором Кубе: Србија остаје посвећена продубљивању веза,https://www.rts.rs/vesti/politika/5790490/aleksandar-vucic-ambasador-kube.html,"петак, 19. сеп 2025, 12:02 -> 12:10"
"Полиција упала у просторије обезбеђења у КБЦ Косовска Митровица, протест здравствених радника",https://www.rts.rs/vesti/politika/5790477/upad-policija-kosovska-mitrovica.html,"петак, 19. сеп 2025, 11:38 -> 18:18"
"Суђење Тачију у Хагу – између одбране, међународне правде и улоге америчких савезника",https://www.rts.rs/vesti/politika/5790379/taci-hag-odbrana-sudjenje-ovk.html,"петак, 19. сеп 2025, 11:16 -> 11:28"
Управа за извршење кривичних санкција: Притворени студент доброг општег стања,https://www.rts.rs/vesti/politika/5790462/uprava-za-izvrsenje-krivicnih-sankcija-pritvoreni-student-dobrog-opsteg-stanja.html,"петак, 19. сеп 2025, 10:46 -> 11:05"
"Вучић: Плашим се да неће бити одлагања за НИС,  ванредно повећање плата просвети и здравству",https://www.rts.rs/vesti/politika/5790430/aleksandar-vucic-nis-sankcije.html,"петак, 19. сеп 2025, 09:21 -> 11:13"
"Гашић: Све је спремно за војну параду, позивам грађане да дођу да заједно прикажемо снагу јединства",https://www.rts.rs/vesti/politika/5790400/gasic-sve-je-spremno-za-vojnu-paradu-pozivam-gradjane-da-dodju-da-zajedno-prikazemo-snagu-jedinstva.html,"петак, 19. сеп 2025, 08:15 -> 09:16"
Владици Ћирковићу из Грачанице одузето возило са српским таблицама,https://www.rts.rs/vesti/politika/5790399/srbin-oduzeto-vozilo-kim.html,"петак, 19. сеп 2025, 07:40 -> 08:07"
Хоће ли Срби са Косова и Метохије на сопственом огњишту постати странци,https://www.rts.rs/vesti/politika/5790325/hoce-li-srbi-sa-kosova-i-metohije-na-sopstvenom-ognjistu-postati-stranci.html,"петак, 19. сеп 2025, 05:50 -> 06:01"
Захарова: Циљ Запада да потпуно изолује Србију и окружи је непријатељским снагама,https://www.rts.rs/vesti/politika/5790308/zaharova-cilj-zapada-da-potpuno-izoluje-srbiju-i-okruzi-je-neprijateljskim-snagama.html,"четвртак, 18. сеп 2025, 20:02 -> 20:24"
