headline,url,datePublished
Орбан: ЕУ мора да зна да без Србије нема стабилног Западног Балкана; Вучић: Можемо да будемо највернији пријатељ Мађарске,https://www.rts.rs/vesti/politika/5653866/orban-eu-mora-da-zna-da-bez-srbije-nema-stabilnog-zapadnog-balkana-vucic-mozemo-da-budemo-najverniji-prijatelj-madjarske.html,"понедељак, 17. феб 2025, 16:30 -> 21:17"
Иницијатива ,https://www.rts.rs/vesti/politika/5653926/inicijativa-proglas-resenje-za-izlazak-iz-krize-formiranje-prelazne-vlade.html,"понедељак, 17. феб 2025, 13:45 -> 19:09"
Канцеларија за КиM: Привремене институције самоуправе у Приштини прослављају непостојећи празник непостојеће државе,https://www.rts.rs/vesti/politika/5653687/kancelarija-za-kim-kosovo-17-godina-samoproglasena-nezavisnost.html,"понедељак, 17. феб 2025, 11:56 -> 11:59"
Брнабић: Предате прве уставне жалбе због повреде права на образовање у основним школама,https://www.rts.rs/vesti/politika/5653818/brnabic-zalbe-ustavni-sud-prosveta-strajk.html,"понедељак, 17. феб 2025, 11:40 -> 14:50"
Лавров са Ђурићем: Русија и Србија договориле заједнички рад да избегну штету од санкција НИС-у,https://www.rts.rs/vesti/politika/5653669/lavrov-sa-djuricem-rusija-i-srbija-dogovorile-zajednicki-rad-da-izbegnu-stetu-od-sankcija-nis-u.html,"понедељак, 17. феб 2025, 11:35 -> 19:50"
Ђурић и Лавров у Москви о билатералним односима и питањима од обостраног интереса,https://www.rts.rs/vesti/politika/5653644/marko-djuric-sergej-lavrov-moskva.html,"понедељак, 17. феб 2025, 10:39 -> 14:11"
Дрецун: Обичан народ нема разлога за славље 17 година после једностраног проглашења независности,https://www.rts.rs/vesti/politika/5653591/drecun-obican-narod-nema-razloga-za-slavlje-17-godina-posle-jednostranog-proglasenja-nezavisnosti.html,"понедељак, 17. феб 2025, 08:00 -> 08:28"
"Вучић: Протести донели велике проблеме економији, најважније да сачувамо радна места",https://www.rts.rs/vesti/politika/5653500/aleksandar-vucic.html,"недеља, 16. феб 2025, 21:34 -> 07:32"
"Ђурић започео посету Москви, обишао Храм Христа Спаситеља и Музеј победе",https://www.rts.rs/vesti/politika/5653411/marko-djuric-poseta-moskvi.html,"недеља, 16. феб 2025, 18:41 -> 20:02"
"Декларација о Војводини усвојена акламацијом у Сремској Митровици, Вучић: Победила је Србија, пропала им је обојена револуција",https://www.rts.rs/vesti/politika/5652969/deklaracija-o-vojvodini-usvojena-aklamacijom-u-sremskoj-mitrovici-vucic-pobedila-je-srbija-propala-im-je-obojena-revolucija.html,"субота, 15. феб 2025, 12:04 -> 20:14"
Предлог текста народне декларације о Војводини,https://www.rts.rs/vesti/politika/5653025/sretenje-deklaracija-vojvodina.html,"субота, 15. феб 2025, 11:48 -> 18:52"
Вучевић: Сретење добар датум да почнемо да разговарамо,https://www.rts.rs/vesti/politika/5652951/vucevic-sretenje-dobar-datum-da-pocnemo-da-razgovaramo.html,"субота, 15. феб 2025, 08:11 -> 11:25"
Петковић: Курти фалсификује чињенице о дијалогу као што покушава да лажира изборе,https://www.rts.rs/vesti/politika/5652460/petkovic-kurti-falsifikuje-cinjenice-o-dijalogu-kao-sto-pokusava-da-lazira-izbore.html,"петак, 14. феб 2025, 16:52 -> 17:09"
Ђурић са Соренсеном о положају Срба на КиМ: Приштина одбија да испуни обавезе,https://www.rts.rs/vesti/politika/5652118/peter-sorensen-marko-djuric-kim-pristina.html,"петак, 14. феб 2025, 14:42 -> 19:55"
Светски лидери честитају председнику Србије Дан државности,https://www.rts.rs/vesti/politika/5651653/svetski-lideri-cestitaju-predsedniku-srbije-dan-drzavnosti.html,"петак, 14. феб 2025, 10:33 -> 16:26"
"Додик: Сарадња РС и Србије никад боља; Вучић: Градимо заједничку будућност, не рушећи никога",https://www.rts.rs/vesti/politika/5651593/srbija-republika-srpska-dodik-vucic-palata-banjaluka.html,"петак, 14. феб 2025, 09:36 -> 11:34"
Србија и РС славе Сретење; Вучић: Пружамо руку онима који је нису никада хтели; Додик: Увек имамо на уму да смо Срби,https://www.rts.rs/vesti/politika/5651070/republika-srpska-srbija-zajedno-sretenje-akademija-banjaluka.html,"четвртак, 13. феб 2025, 18:00 -> 19:34"
"Вучић допутовао у Бањалуку, дочекао га Додик",https://www.rts.rs/vesti/politika/5651176/vucic-doputovao-u-banjaluku-docekao-ga-dodik.html,"четвртак, 13. феб 2025, 17:28 -> 17:55"
"Ердоган, Зеленски, Матарела и Алијев честитали Вучићу и српском народу Дан државности",https://www.rts.rs/vesti/politika/5651049/erdogan-zelenski-vucic-matarela-alijev-srbija-dan-drzavnosti-cestitke.html,"четвртак, 13. феб 2025, 17:00 -> 17:53"
"Шапић: Возни парк аутобуса биће потпуно обновљен, до краја пролећа стиже 150 возила",https://www.rts.rs/vesti/politika/5651100/sapic-vozni-park-autobus.html,"четвртак, 13. феб 2025, 16:57 -> 18:03"
Србија се ускладила са одлукама Савета ЕУ о борби против тероризма,https://www.rts.rs/vesti/politika/5650989/srbija-se-uskladila-sa-odlukama-saveta-eu-o-borbi-protiv-terorizma.html,"четвртак, 13. феб 2025, 16:25 -> 16:31"
Влада кориговала коефицијенте за плате запослених у области социјалне заштите,https://www.rts.rs/vesti/politika/5650944/vlada-srbije-socijalna-zastita-ruralni-turizam.html,"четвртак, 13. феб 2025, 15:53 -> 16:21"
"Ђедовић: Мађарска подржала Србију по питању НИС-а, МОЛ понудио да дуплира капацитете",https://www.rts.rs/vesti/politika/5650937/srbija-madjarska-djuric-djedovic-handanovic-energetika.html,"четвртак, 13. феб 2025, 15:48 -> 20:22"
Вучић са директором Росатома о сарадњи Србије и Русије у енергетском сектору,https://www.rts.rs/vesti/politika/5650750/vucic-rosatom-srbija-rusija-saradnja.html,"четвртак, 13. феб 2025, 12:03 -> 16:31"
"Дводневно обележавање Сретења у Републици Српској, присуствује председник Вучић",https://www.rts.rs/vesti/politika/5650486/sretenje-banjaluka-republika-srpska-dodik-vucic.html,"четвртак, 13. феб 2025, 06:05 -> 14:38"
"И после Куртија – Курти, или опозиција са Српском листом – ко ће формирати нову владу у Приштини",https://www.rts.rs/vesti/politika/5650323/kosovo-metohija-izbori-parlamentarni-.html,"среда, 12. феб 2025, 20:00 -> 21:26"
Председник Кине Си Ђинпинг честитао председнику Вучићу Дан државности ,https://www.rts.rs/vesti/politika/5650049/predsednik-kine-si-djinping-cestitao-predsedniku-vucicu-dan-drzavnosti-.html,"среда, 12. феб 2025, 11:50 -> 19:10"
Калас и Кос: Приштина да спроведе обавезе из споразума са Београдом без одлагања и предуслова,https://www.rts.rs/vesti/politika/5649949/kalas-i-kos-pristina-da-sprovede-obaveze-iz-sporazuma-sa-beogradom-bez-odlaganja-i-preduslova.html,"среда, 12. феб 2025, 09:27 -> 09:33"
"Ђурић за РТС:  Циљ Приштине да се пресеку све везе Срба са Београдом, не желимо да слушамо Куртијеве монологе ",https://www.rts.rs/vesti/politika/5649909/djuric-za-rts-cilj-pristine-da-se-preseku-sve-veze-srba-sa-beogradom-ne-zelimo-da-slusamo-kurtijeve-monologe-.html,"среда, 12. феб 2025, 08:00 -> 09:34"
Кос: Србији неопходан дијалог свих актера политичког живота и цивилног друштва,https://www.rts.rs/vesti/politika/5649868/marta-kos-evropska-unija-evropski-parlament.html,"уторак, 11. феб 2025, 20:18 -> 20:33"
Вучевић: Затражио сам да се обезбеди смештај студентима који пешке путују ка Крагујевцу,https://www.rts.rs/vesti/politika/5649850/studenti-protesti-blokade-vucevic-smestaj.html,"уторак, 11. феб 2025, 19:05 -> 19:12"
Вучић позвао грађане на скуп у Сремској Митровици на Сретење,https://www.rts.rs/vesti/politika/5649735/vucic-pozvao-gradjane-na-skup-u-sremskoj-mitrovici-na-sretenje.html,"уторак, 11. феб 2025, 16:19 -> 07:02"
"Петковић: Покушај прекрајања изборне воље, ЦИК у Приштини не уноси податке о гласовима Срба",https://www.rts.rs/vesti/politika/5649705/petar-petkovic-izbori-na-kim.html,"уторак, 11. феб 2025, 16:03 -> 19:32"
"Вучевић:  Неке школе супротно закону не раде, покушаји да се пониште резултати синдиката ",https://www.rts.rs/vesti/politika/5649567/vucevic-neke-skole-suprotno-zakonu-ne-rade-pokusaji-da-se-poniste-rezultati-sindikata-.html,"уторак, 11. феб 2025, 13:51 -> 14:36"
Ђурић: Неће бити прелазне владе; Јовановић: Могућа и блокада аеродрома,https://www.rts.rs/vesti/politika/5649549/jovanovic-djuric-vlada.html,"уторак, 11. феб 2025, 13:17 -> 16:37"
Трамп честитао Вучићу Дан државности: Радујем се даљем јачању нашег партнерства,https://www.rts.rs/vesti/politika/5649433/tramp-cestitao-vucicu-dan-drzavnosti-radujem-se-daljem-jacanju-naseg-partnerstva.html,"уторак, 11. феб 2025, 12:33 -> 16:29"
Председник покрета ,https://www.rts.rs/vesti/politika/5649388/predsednik-pokreta-nasa-drina-istupio-iz-poslanicke-grupe-sps-a.html,"уторак, 11. феб 2025, 12:00 -> 15:11"
"Политичка олуја на КиМ, после мирног изборног дана",https://www.rts.rs/vesti/politika/5649125/politicka-oluja-na-kim-posle-mirnog-izbornog-dana.html,"понедељак, 10. феб 2025, 19:38 -> 21:07"
"Ђурић са Калас: Чланство у ЕУ приоритет Србије, отварање Кластера 3 веома значајно",https://www.rts.rs/vesti/politika/5649118/marko-djuric-kaja-kalas-eu-srbija.html,"понедељак, 10. феб 2025, 19:14 -> 19:48"
"Око: Избори на КиМ – шта говоре резултати, какве су могуће коалиције",https://www.rts.rs/vesti/politika/5649088/oko-izbori-na-kim--sta-govore-rezultati-kakve-su-moguce-koalicije.html,"понедељак, 10. феб 2025, 19:08 -> 19:40"
"Вучић: На Сретење Декларација о Војводини, гаранција за Војводину у Србији",https://www.rts.rs/vesti/politika/5649107/vucic-na-sretenje-deklaracija-o-vojvodini-garancija-za-vojvodinu-u-srbiji.html,"понедељак, 10. феб 2025, 18:54 -> 21:12"
"Вучић: Увек сам за дијалог, зато га и нудим, разговор је лековит, важан и благородан",https://www.rts.rs/vesti/politika/5648861/vucic-uvek-sam-za-dijalog-zato-ga-i-nudim-razgovor-je-lekovit-vazan-i-blagorodan.html,"понедељак, 10. феб 2025, 13:40 -> 16:15"
Влада прихватила измене Колективног уговора за раднике Електродистрибуције Србије,https://www.rts.rs/vesti/politika/5648778/vlada-prihvatila-izmene-kolektivnog-ugovora-za-radnike-elektrodistribucije-srbije.html,"понедељак, 10. феб 2025, 13:14 -> 13:40"
"Каменована кућа породице Ђорић у Липљану, поломљени прозори",https://www.rts.rs/vesti/politika/5648675/kamenovana-kuca-porodice-djoric-u-lipljanu-polomljeni-prozori.html,"понедељак, 10. феб 2025, 12:18 -> 12:47"
"Курти неће моћи сам да формира владу, Српској листи свих десет мандата",https://www.rts.rs/vesti/politika/5648310/kurti-nece-moci-sam-da-formira-vladu-srpskoj-listi-svih-deset-mandata.html,"понедељак, 10. феб 2025, 08:00 -> 14:13"
"Дан после избора на КиМ, Београд оцењује: Оловка победила дуге цеви Аљбина Куртија",https://www.rts.rs/vesti/politika/5648302/dan-posle-izbora-na-kim-beograd-ocenjuje-olovka-pobedila-duge-cevi-aljbina-kurtija.html,"понедељак, 10. феб 2025, 07:14 -> 14:10"
"Вучић: Српска листа освојила свих 10 мандата, честитам српском народу на КиМ",https://www.rts.rs/vesti/politika/5648273/vucic-srpska-lista-osvojila-svih-10-mandata-cestitam-srpskom-narodu-na-kim.html,"недеља, 09. феб 2025, 23:07 -> 06:25"
Излазне анкете после избора на КиМ: Курти ће морати да тражи коалиционог партнера; Српској листи десет мандата,https://www.rts.rs/vesti/politika/5648161/izbori-parlamentarni-2025-kosovo-metohija-srbi-rezultati-.html,"недеља, 09. феб 2025, 19:00 -> 23:33"
"Ђурић: Из Париза шаљемо поруку да је Србија јака, слободна и отворена за бизнис",https://www.rts.rs/vesti/politika/5648137/marko-djuric-pariz-gpai-vestacka-inteligencija-srbija-jaka-slobodna-otvorena.html,"недеља, 09. феб 2025, 18:16 -> 21:43"
Вучевић: Очекујем брз одговор САД о захтеву за одлагања санкција НИС-у,https://www.rts.rs/vesti/politika/5648031/vucevic-ocekujem-brz-odgovor-sad-o-zahtevu-za-odlaganja-sankcija-nis-u.html,"недеља, 09. феб 2025, 11:52 -> 12:01"
 Ђурић у Паризу: Сарадња Србије и Француске има стратешки карактер,https://www.rts.rs/vesti/politika/5648028/marko-djuric-zukan-helez-optuzbe-bih.html,"недеља, 09. феб 2025, 11:43 -> 14:43"
"Избори на Косову и Метохији, учествује шест српских странака",https://www.rts.rs/vesti/politika/5647951/izbori-parlamentarni-2025-kosovo-metohija-srbi-.html,"недеља, 09. феб 2025, 05:50 -> 17:05"
Парламентарни избори на Косову и Метохији – враћање у институције кључни политички циљ Срба,https://www.rts.rs/vesti/politika/5647831/parlamentarni-izbori-na-kosovu-i-metohiji--vracanje-u-institucije-kljucni-politicki-cilj-srba.html,"субота, 08. феб 2025, 20:00 -> 20:25"
"Вучић: Да ли је експлодирала гума или било шта друго, биће утврђено",https://www.rts.rs/vesti/politika/5647794/vucic-da-li-je-eksplodirala-guma-ili-bilo-sta-drugo-bice-utvrdjeno.html,"субота, 08. феб 2025, 16:23 -> 23:43"
Вучић: Дијалог једини начин за излазак из политичке кризе у Србији; Макрон: Пронаћи пут ка дијалогу и јачању поверења у институције,https://www.rts.rs/vesti/politika/5647763/vucic-makron-razgovor.html,"субота, 08. феб 2025, 13:57 -> 15:59"
"Вучевић: Нећу повући оставку, ја сам за избор новог мандатара и нове владе",https://www.rts.rs/vesti/politika/5647758/vucevic-necu-povuci-ostavku-ja-sam-za-izbor-novog-mandatara-i-nove-vlade.html,"субота, 08. феб 2025, 13:07 -> 13:18"
"Руска странка демантовала своје јучерашње саопштење, ипак настављају подршку СНС-у и градској управи у Нишу",https://www.rts.rs/vesti/politika/5647747/ruska-stranka-demantovala-svoje-jucerasnje-saopstenje-ipak-nastavljaju-podrsku-sns-u-i-gradskoj-upravi-u-nisu.html,"субота, 08. феб 2025, 12:21 -> 13:30"
"Петковић: Приштина пласира лажи уочи избора, расељени Срби са Косова моћи ће да дођу на гласање",https://www.rts.rs/vesti/politika/5647732/petkovic-pristina-plasira-lazi-uoci-izbora-raseljeni-srbi-sa-kosova-moci-ce-da-dodju-na-glasanje.html,"субота, 08. феб 2025, 11:08 -> 11:16"
"Председник Српске листе: Сутра немамо право на грешку, Срби да гласају у што већем броју",https://www.rts.rs/vesti/politika/5647690/predsednik-srpske-liste-sutra-nemamo-pravo-na-gresku-srbi-da-glasaju-u-sto-vecem-broju.html,"субота, 08. феб 2025, 08:40 -> 08:53"
Вучић у Кикинди: У Србији неће бити револуције; Срби са КиМ да изађу на изборе и гласају за Српску листу,https://www.rts.rs/vesti/politika/5647684/vucic-poseta-severnobanatskom-i-srednjobanatskom-okrugu.html,"субота, 08. феб 2025, 07:43 -> 19:56"
"Миливојевић: Гренел говори у име Беле куће, став према Куртију није позитиван",https://www.rts.rs/vesti/politika/5647669/milivojevic-grenel-govori-u-ime-bele-kuce-stav-prema-kurtiju-nije-pozitivan.html,"субота, 08. феб 2025, 07:11 -> 08:26"
Организовани превоз бирача на дан избора на КиМ неће бити могућ без претходне дозволе,https://www.rts.rs/vesti/politika/5647607/kim-izbori-prevoz.html,"петак, 07. феб 2025, 22:07 -> 22:25"
Ниш: Руска странка ускратила подршку коалицији око напредњака,https://www.rts.rs/vesti/politika/5647564/nis-ruska-stranka-uskratila-podrsku-koaliciji-oko-naprednjaka.html,"петак, 07. феб 2025, 20:53 -> 22:36"
"Српска листа одржала завршни митинг у Звечану, позвала Србе да у што већем броју изађу на изборе",https://www.rts.rs/vesti/politika/5647259/srpska-lista-odrzala-zavrsni-miting-u-zvecanu-pozvala-srbe-da-u-sto-vecem-broju-izadju-na-izbore.html,"петак, 07. феб 2025, 16:08 -> 19:27"
Нови захтев суду у Приштини да Трајковићу одреди кућни притвор,https://www.rts.rs/vesti/politika/5646621/sladjan-trjkovic-kim-pristina.html,"петак, 07. феб 2025, 12:49 -> 13:15"
"Вучић у Чоки: На рачуну имамо готово пет милијарди евра, БДП ове године достиже 90 милијарди",https://www.rts.rs/vesti/politika/5646564/vucic-u-coki-na-racunu-imamo-gotovo-pet-milijardi-evra-bdp-ove-godine-dostize-90-milijardi.html,"петак, 07. феб 2025, 12:20 -> 14:08"
Вучић: На Сретење или дан раније донећемо декларацију о Војводини у Србији,https://www.rts.rs/vesti/politika/5646345/vucic-na-sretenje-ili-dan-ranije-donecemo-deklaraciju-o-vojvodini-u-srbiji.html,"петак, 07. феб 2025, 10:42 -> 10:48"
"Гренел: Курти је у заблуди, односи Вашингтона и Приштине на најнижем нивоу",https://www.rts.rs/vesti/politika/5646240/grenel-kurti-kim.html,"петак, 07. феб 2025, 08:50 -> 09:15"
"Уочи избора на КиМ, ко може гласати из централне Србије и где",https://www.rts.rs/vesti/politika/5646209/uoci-izbora-na-kim-ko-moze-glasati-iz-centralne-srbije-i-gde.html,"петак, 07. феб 2025, 08:01 -> 09:07"
"Вучић за РТС: Инсистираћу на дијалогу, верујем да ће студенти имати више храбрости од неких професора",https://www.rts.rs/vesti/politika/5646036/vucic-za-rts-insistiracu-na-dijalogu-verujem-da-ce-studenti-imati-vise-hrabrosti-od-nekih-profesora.html,"четвртак, 06. феб 2025, 20:55 -> 22:37"
Соренсен разговарао са Петковићем и Бисљимијем,https://www.rts.rs/vesti/politika/5646057/sorensen-razgovarao-sa-petkovicem-i-bisljimijem.html,"четвртак, 06. феб 2025, 20:37 -> 20:48"
Заставе Албаније и бивше ОВК на игралишту у српском делу Ораховца,https://www.rts.rs/vesti/politika/5645974/zastave-ovk-i-albanije-orahovac.html,"четвртак, 06. феб 2025, 19:04 -> 19:10"
Сведоци тужилаштва у Приштини: Нисмо видели Костића и Миловића на месту злочина,https://www.rts.rs/vesti/politika/5645863/svedoci-tuzilastva-u-pristini-nismo-videli-kostica-i-milovica-na-mestu-zlocina.html,"четвртак, 06. феб 2025, 16:15 -> 16:30"
На кући Јанковића у селу Бушинце исписани графити УЧК,https://www.rts.rs/vesti/politika/5645795/srpska-lsita-uck-kuca-jankovici.html,"четвртак, 06. феб 2025, 14:38 -> 14:47"
Председник Александар Вучић вечерас гост емисије Четвртком у 9,https://www.rts.rs/vesti/politika/5645524/predsednik-aleksandar-vucic-veceras-gost-emisije-cetvrtkom-u-9.html,"четвртак, 06. феб 2025, 12:17 -> 12:51"
"Сарадња, историјско наслеђе, жути аутобуси и наравно Пикси - из угла јапанског амбасадора у Београду",https://www.rts.rs/vesti/politika/5645461/saradnja-istorijsko-nasledje-zuti-autobusi-i-naravno-piksi---iz-ugla-japanskog-ambasadora-u-beogradu.html,"четвртак, 06. феб 2025, 11:41 -> 17:34"
Шолц писао Вучићу: Немачка ће учествовати на изложби Експо у Београду,https://www.rts.rs/vesti/politika/5645367/vucic-solc-ekspo-pismo.html,"четвртак, 06. феб 2025, 10:11 -> 10:26"
Мали: Влада донела решење - за високо образовање додатних 12 милијарди динара ,https://www.rts.rs/vesti/politika/5645334/sinisa-mali-studenti-sredstva-visoko-obrazovanje.html,"четвртак, 06. феб 2025, 09:48 -> 09:58"
Митрополит Теодосије позвао Србе да гласају на изборима на КиМ у што већем броју,https://www.rts.rs/vesti/politika/5645302/mitropolit-teodosije-pozvao-srbe-da-glasaju-na-izborima-na-kim-u-sto-vecem-broju.html,"четвртак, 06. феб 2025, 09:24 -> 09:44"
Интерно расељени Срби позвани да гласају на изборима на Косову и Метохији,https://www.rts.rs/vesti/politika/5645058/interno-raseljeni-srbi-pozvani-da-glasaju-na-izborima-na-kosovu-i-metohiji.html,"среда, 05. феб 2025, 18:52 -> 20:31"
Ђурић разговарао са помоћником за Европу и Евроазију у Стејт департменту Луисом Боноом,https://www.rts.rs/vesti/politika/5645035/djuric-razgovarao-sa-pomocnikom-za-evropu-i-evroaziju-u-stejt-departmentu-luisom-bonoom.html,"среда, 05. феб 2025, 18:31 -> 18:36"
"Вучевићева оставка стигла у Скупштину Србије, који су наредни кораци",https://www.rts.rs/vesti/politika/5644903/vuceviceva-ostavka-stigla-u-skupstinu-srbije-koji-su-naredni-koraci.html,"среда, 05. феб 2025, 16:01 -> 19:44"
"Митинг Српске листе у Косовској Митровици: Морамо да подигнемо главу, ујединимо се и заједно победимо",https://www.rts.rs/vesti/politika/5644865/srpska-lista-izbori-kosovo-metohija-mitrovica-miting.html,"среда, 05. феб 2025, 15:49 -> 16:42"
