headline,url,datePublished
"Сарадња српске и америчке војске, одржан пријем у амбасади САД",https://www.rts.rs/vesti/politika/5790280/saradnja-srpske-i-americke-vojske-odrzan-prijem-u-ambasadi-sad.html,"четвртак, 18. сеп 2025, 19:31 -> 19:41"
Вучинић се извинио због изјаве да неко планира убиство Павла Цицварића; отац ужичког студeнта: Тужилаштво дужно да реагује,https://www.rts.rs/vesti/politika/5790204/vucinic-se-izvinio-zbog-izjave-da-neko-planira-ubistvo-pavla-cicvarica-otac-uzickog-studenta-tuzilastvo-duzno-da-reaguje.html,"четвртак, 18. сеп 2025, 16:33 -> 16:36"
Влада усвојила програме за подршку женском предузетништву и старим занатима,https://www.rts.rs/vesti/politika/5790211/vlada-usvojila-programe-za-podrsku-zenskom-preduzetnistvu-i-starim-zanatima.html,"четвртак, 18. сеп 2025, 16:09 -> 16:30"
Петковић: Нове претње Приштине имају за циљ нови талас прогона и протеривања Срба,https://www.rts.rs/vesti/politika/5790207/pristina-petkovic-kosovo-metohija.html,"четвртак, 18. сеп 2025, 15:57 -> 16:09"
Вучић са командантом Националне гарде Охаја о безбедносној ситуацији и сарадњи ,https://www.rts.rs/vesti/politika/5790184/srbija-ohajo-vucic-vudraf.html,"четвртак, 18. сеп 2025, 14:49 -> 14:56"
Премијер Мацут са ректорима универзитета: Нова академска година почиње до 3. новембра,https://www.rts.rs/vesti/politika/5790179/premijer-macut-sa-rektorima-univerziteta-nova-akademska-godina-pocinje-do-3-novembra.html,"четвртак, 18. сеп 2025, 14:47 -> 14:53"
"Вучић са Ли Мингом сумирао недавну посету Пекингу, акценат на састанку са Си Ђинпингом",https://www.rts.rs/vesti/politika/5790126/vucic-li-ming-sastanak-srbija-kina-si-djinping.html,"четвртак, 18. сеп 2025, 12:53 -> 12:59"
"Протести у више градова, захтев да се притвореном студенту омогући да се брани са слободе",https://www.rts.rs/vesti/politika/5790097/-beograd-protesti-novi-sad-studenti.html,"четвртак, 18. сеп 2025, 12:06 -> 21:52"
Управа за извршење кривичних санкција демантује наводе о нехуманом поступању према притвореном студенту,https://www.rts.rs/vesti/politika/5790067/uprava-za-izvrsenje-krivicnih-sankcija-demantuje-navode-o-nehumanom-postupanju-prema-pritvorenom-studentu.html,"четвртак, 18. сеп 2025, 11:27 -> 12:06"
Вучић са Гашићем и Мојсиловићем: Грађани ће на војној паради видети снажну српску армију,https://www.rts.rs/vesti/politika/5790063/vucic-vojna-parada.html,"четвртак, 18. сеп 2025, 11:22 -> 11:26"
Ненад Вујић: Изменама кривичног законика пооштрене мере за силоватеље,https://www.rts.rs/vesti/politika/5789955/nenad-vujic-izmene-krivicnog-zakonika.html,"четвртак, 18. сеп 2025, 08:55 -> 14:19"
"Скуп подршке студенту и пољопривредницима у Новом Саду, блокиран Варадински мост ",https://www.rts.rs/vesti/politika/5789843/protesti-novi-sad-pritvoreni-student-beograd-pavle-savic.html,"среда, 17. сеп 2025, 21:06 -> 22:56"
ССП: Разбијене просторије странке у Алибунару,https://www.rts.rs/vesti/politika/5789836/ssp-razbijene-prostorije-alibunar-stranka-slobode-i-pravde-.html,"среда, 17. сеп 2025, 20:48 -> 20:57"
"Командант Националне гарде Охаја у Србији, састанак са генералом Мојсиловићем",https://www.rts.rs/vesti/politika/5789806/komandant-nacionalne-garde-ohaja-mojsilovic-.html,"среда, 17. сеп 2025, 18:59 -> 19:09"
Управа о притвореном студенту: Пребачен је у болницу касно поподне,https://www.rts.rs/vesti/politika/5789800/bojan-jovicic-student-strajk-gladju-uprava-za-izvrsenje-krivicnih-sankcija.html,"среда, 17. сеп 2025, 18:41 -> 22:00"
У Приштини почело поновљено суђење Душку Арсићу због наводног ратног злочина,https://www.rts.rs/vesti/politika/5789776/dusko-arsic-navodni-ratni-zlocin-pristina.html,"среда, 17. сеп 2025, 17:28 -> 17:45"
Ухапшеном Србину из Гњилана одређен притвор до месец дана,https://www.rts.rs/vesti/politika/5789765/uhapsenom-srbinu-iz-gnjilana-odredjen-pritvor-do-mesec-dana.html,"среда, 17. сеп 2025, 16:45 -> 17:31"
На зиду дворишта цркве у Косовској Витини исписани погрдни графити ,https://www.rts.rs/vesti/politika/5789716/kosovska-vitina-grafiti-srbi-spc.html,"среда, 17. сеп 2025, 15:09 -> 15:56"
Студенти у блокади: Студент ФТН-а који штрајкује глађу у затворској болници; Управа: Не налази се у болници,https://www.rts.rs/vesti/politika/5789683/studenti-u-blokadi-student-ftn-a-koji-strajkuje-gladju-u-zatvorskoj-bolnici-uprava-ne-nalazi-se-u-bolnici.html,"среда, 17. сеп 2025, 13:36 -> 15:03"
Позив интерно расељеним лицима да гласају на изборима на Косову и Метохији,https://www.rts.rs/vesti/politika/5789546/kosovo-metohija-glasanje.html,"среда, 17. сеп 2025, 09:00 -> 09:31"
"Миловић за РТС: Очекујемо нове опструкције уочи избора, знају да Српска листа има највећу подршку српског народа",https://www.rts.rs/vesti/politika/5789522/milovic-za-rts-ocekujemo-nove-opstrukcije-uoci-izbora-znaju-da-srpska-lista-ima-najvecu-podrsku-srpskog-naroda.html,"среда, 17. сеп 2025, 08:45 -> 15:06"
"Вучић: Посета Јапану била веома добра и плодоносна, очекујем велике резултате",https://www.rts.rs/vesti/politika/5789510/vucic-poseta-japanu-bila-veoma-dobra-i-plodonosna-ocekujem-velike-rezultate.html,"среда, 17. сеп 2025, 06:15 -> 08:53"
Шапић о примедбама ревизора: Ти проблеми у градској управи постоје дуже од 20 година,https://www.rts.rs/vesti/politika/5789419/sapic-o-primedbama-revizora-ti-problemi-u-gradskoj-upravi-postoje-duze-od-20-godina.html,"уторак, 16. сеп 2025, 17:45 -> 19:21"
"Вучић: Организатори обојене револуције неће одустати, спремни смо да одбранимо Србију",https://www.rts.rs/vesti/politika/5789416/aleksandar-vucic-obojena-revolucija-majdan.html,"уторак, 16. сеп 2025, 17:38 -> 18:07"
"Почело суђење Јелени Ђукановић, осумњиченој за наводну шпијунажу; негирала кривицу",https://www.rts.rs/vesti/politika/5789160/pocelo-sudjenje-jeleni-djukanovic-osumnjicenoj-za-navodnu-spijunazu-negirala-krivicu.html,"уторак, 16. сеп 2025, 12:09 -> 19:43"
Председник Вучић са царем Нарухитом: Србија и Јапан заједно гледају у будућност,https://www.rts.rs/vesti/politika/5788812/vucic-japan-car-naruhito.html,"уторак, 16. сеп 2025, 06:06 -> 15:52"
"Џонатан Мур за РТС: Главни амерички интерес је стабилност, време је за одговарајуће власти у Приштини",https://www.rts.rs/vesti/politika/5788610/dzonatan-mur-za-rts-glavni-americki-interes-je-stabilnost-vreme-je-za-odgovarajuce-vlasti-u-pristini.html,"понедељак, 15. сеп 2025, 20:00 -> 20:03"
"Српске заставе истакнуте на амбасадама, конзулатима и мисијама широм света",https://www.rts.rs/vesti/politika/5788581/dan-srpskog-jedinstva-ambasade-konzulati-.html,"понедељак, 15. сеп 2025, 17:46 -> 18:15"
Мацут са председавајућом ОЕБС-а: Ценимо подршку  Србији на путу ка ЕУ,https://www.rts.rs/vesti/politika/5788565/macut-sa-predsedavajucom-oebs-a-cenimo-podrsku-srbiji-na-putu-ka-eu.html,"понедељак, 15. сеп 2025, 17:02 -> 19:25"
Још једно хапшење на КиМ због наводног ратног злочина,https://www.rts.rs/vesti/politika/5788557/kim-navodni-ratni-zlocin.html,"понедељак, 15. сеп 2025, 16:51 -> 16:58"
У Грачаници представљен кандидат Српске листе за градоначелника,https://www.rts.rs/vesti/politika/5788466/gracanica-srpska-lista-izbori-koovo-metohija.html,"понедељак, 15. сеп 2025, 13:22 -> 15:35"
"Вучић у Осаки: Србија мост између Истока и Запада, српски павиљон посетило 880.000 људи",https://www.rts.rs/vesti/politika/5788164/vucic-u-osaki-srbija-most-izmedju-istoka-i-zapada-srpski-paviljon-posetilo-880000-ljudi.html,"понедељак, 15. сеп 2025, 06:36 -> 13:50"
"Дан српског јединства, слободе и националне заставе – централна манифестација у Гаџином Хану ",https://www.rts.rs/vesti/politika/5788037/dan-srpskog-jedinstva-slobode-i-nacionalne-zastave--centralna-manifestacija-u-gadzinom-hanu-.html,"понедељак, 15. сеп 2025, 05:50 -> 19:34"
Непознати починиоци поставили заставе тзв. ОВК и Албаније на улаз Амбасаде Србије у Хагу,https://www.rts.rs/vesti/politika/5788109/nepoznati-pocinioci-postavili-zastave-tzv-ovk-i-albanije-na-ulaz-ambasade-srbije-u-hagu.html,"недеља, 14. сеп 2025, 21:55 -> 22:54"
Студенти у блокади новосадског ПМФ-а: Полиција користила опасан гас; МУП демантује: Не поседујемо такво средство,https://www.rts.rs/vesti/politika/5788102/studenti-u-blokadi-mup.html,"недеља, 14. сеп 2025, 21:03 -> 21:47"
Протест под слоганом ,https://www.rts.rs/vesti/politika/5788073/protest-pod-sloganom-slobodo-tu-smo-u-novom-sadu.html,"недеља, 14. сеп 2025, 19:12 -> 20:34"
"Разбијено стакло на просторијама СНС-а у Крагујевцу, приведен починилац",https://www.rts.rs/vesti/politika/5788008/sns-prostorije-kragujevac-razbijeno-staklo.html,"недеља, 14. сеп 2025, 14:10 -> 16:39"
"Клачар за РТС: Избори следеће године на јесен реалнија опција од пролећа, студентска листа вероватно без опозиције",https://www.rts.rs/vesti/politika/5787951/bojan-klacar-izbori-protesti.html,"недеља, 14. сеп 2025, 12:20 -> 12:50"
"Вучић у Јапану од 14. до 17. септембра, аудијенција код цара Нарухита",https://www.rts.rs/vesti/politika/5787980/aleksandar-vucic-japan-poseta-car.html,"недеља, 14. сеп 2025, 12:04 -> 15:26"
Петковић: Дијалог у Бриселу одавно постао место где Приштина само симулира преговоре,https://www.rts.rs/vesti/politika/5787974/petkovic-dijalog-u-briselu-kosovo-metohija.html,"недеља, 14. сеп 2025, 11:55 -> 12:03"
"Елек: Наша слога је најјаче оружје, брине нас ћутање међународне заједнице",https://www.rts.rs/vesti/politika/5787973/zlatan-elek-srpska-lista.html,"недеља, 14. сеп 2025, 11:45 -> 13:14"
МУП: На скуповима против блокада учествовало више од 144.000 грађана,https://www.rts.rs/vesti/politika/5787860/mup-na-skupovima-protiv-blokada-ucestvovalo-vise-od-144000-gradjana.html,"субота, 13. сеп 2025, 20:13 -> 23:13"
"Вучић:  Народ је победио, сад треба сви да се ујединимо и кренемо напред",https://www.rts.rs/vesti/politika/5787835/vucic-narod-je-pobedio-sad-treba-svi-da-se-ujedinimo-i-krenemo-napred.html,"субота, 13. сеп 2025, 18:38 -> 20:56"
"Мањи инциденти у Краљеву, полиција раздвајала паралелне скупове",https://www.rts.rs/vesti/politika/5787831/protesti-kraljevo-incidenti-studenti-protiv-blokada.html,"субота, 13. сеп 2025, 18:32 -> 20:34"
У Београду протест ,https://www.rts.rs/vesti/politika/5787817/u-beogradu-protest-javna-dobra-su-vrednost-a-ne-roba-okupljanja-i-u-drugim-gradovima.html,"субота, 13. сеп 2025, 18:06 -> 22:31"
"Скупови против блокада широм Србије, порука окупљених: Желимо нормалну, стабилну и безбедну Србију",https://www.rts.rs/vesti/politika/5787759/sns-skupovi-protiv-blokada.html,"субота, 13. сеп 2025, 17:30 -> 21:59"
"Приштина, одређен притвор Радомиру Делићу из Звечана",https://www.rts.rs/vesti/politika/5787740/zvecan-pritvor-srbin-kosovo-metohija.html,"субота, 13. сеп 2025, 13:29 -> 16:25"
Српска листа у поноћ почела кампању за локалне изборе на Косову и Метохији,https://www.rts.rs/vesti/politika/5787621/srpska-lista-u-ponoc-pocela-kampanju-za-lokalne-izbore-na-kosovu-i-metohiji.html,"субота, 13. сеп 2025, 06:05 -> 07:49"
"Вучић: Могућност да превремени избори буду у априлу, мају или децембру следеће године",https://www.rts.rs/vesti/politika/5787537/aleksandar-vucic-carli-kirk-nepal-srbija.html,"петак, 12. сеп 2025, 22:40 -> 23:26"
Најава ограничења управљања возилима са српским таблицама на северу КиМ,https://www.rts.rs/vesti/politika/5787517/policija-nove-mere-kim-srpske-tablice-.html,"петак, 12. сеп 2025, 21:15 -> 21:32"
Побуна против Америке: Прва пацка Трампове Беле куће влади Аљбина Куртија,https://www.rts.rs/vesti/politika/5787454/sad-pristina-strateski-dijalog-.html,"петак, 12. сеп 2025, 18:53 -> 18:38"
"Брнабић: Састанци у Бриселу веома добри, главна тема Кластер 3",https://www.rts.rs/vesti/politika/5787473/brnabic-eu-ziofre.html,"петак, 12. сеп 2025, 18:22 -> 21:23"
САД обустављају стратешки дијалог са Приштином,https://www.rts.rs/vesti/politika/5787405/sad-obustavljaju-strateski-dijalog-sa-pristinom.html,"петак, 12. сеп 2025, 14:53 -> 14:59"
Србин из Звечана ухапшен због сумње да је наводно починио ратни злочин,https://www.rts.rs/vesti/politika/5787371/pristina-hapsenje-kosovo-i-ketohija-ratni-zlocin.html,"петак, 12. сеп 2025, 14:00 -> 14:35"
Министарство просвете: Уводе се привремене мере у Ваздухопловној академији,https://www.rts.rs/vesti/drustvo/5787330/ministarstvo-prosvete-uvode-se-privremene-mere-u-vazduhoplovnoj-akademiji.html,"петак, 12. сеп 2025, 13:19 -> 13:54"
"Вучић: Војна парада нема везе са дневним догађајима, то је израз жеље да се покаже колико је војска напредовала",https://www.rts.rs/vesti/politika/5787305/vucic-vojna-parada-nema-veze-sa-dnevnim-dogadjajima-to-je-izraz-zelje-da-se-pokaze-koliko-je-vojska-napredovala.html,"петак, 12. сеп 2025, 12:33 -> 12:45"
Настављају се упади у српске институције на северу КиМ — у Косовској Митровици скинута српска застава са зграде ПИО фонда,https://www.rts.rs/vesti/politika/5787279/nastavljaju-se-upadi-u-srpske-institucije-na-severu-kim--u-kosovskoj-mitrovici-skinuta-srpska-zastava-sa-zgrade-pio-fonda.html,"петак, 12. сеп 2025, 11:53 -> 14:16"
Петковић: Полиција привремених институција упала у објекте ПИО фонда и РФЗО у Косовској Митровици,https://www.rts.rs/vesti/politika/5787264/petkovic-policija-privremenih-institucija-upala-u-objekte-pio-fonda-i-rfzo-u-kosovskoj-mitrovici.html,"петак, 12. сеп 2025, 11:36 -> 12:19"
Америчка амбасада у Приштини: Куртијеве изјаве погоршавају међуетничке тензије,https://www.rts.rs/vesti/politika/5787186/americka-ambasada-u-pristini-kurtijeve-izjave-pogorsavaju-medjuetnicke-tenzije.html,"петак, 12. сеп 2025, 10:30 -> 13:55"
"Брнабић: Одличан састанак са Мецолом, разговори о даљим европским интеграцијама Србије",https://www.rts.rs/vesti/politika/5787172/brnabic-odlican-sastanak-sa-mecolom-razgovori-o-daljim-evropskim-integracijama-srbije.html,"петак, 12. сеп 2025, 10:19 -> 13:19"
Ђурић на отварању конзулата Јужне Африке: Предложићу да улица у Београду буде названа по Мандели,https://www.rts.rs/vesti/politika/5787122/marko-djuric-konzulat-juzna-afrika.html,"четвртак, 11. сеп 2025, 22:49 -> 23:15"
Србија одиграла кључну улогу у евакуацији пет новинара америчког Ен-Би-Сија из Газе ,https://www.rts.rs/vesti/politika/5787057/srbija-odigrala-kljucnu-ulogu-u-evakuaciji-pet-novinara-americkog-en-bi-sija-iz-gaze-.html,"четвртак, 11. сеп 2025, 20:00 -> 20:44"
Тужилаштво у Приштини подигло оптужницу због наводне шпијунаже,https://www.rts.rs/vesti/politika/5786687/pristina-spijunaza-bia.html,"четвртак, 11. сеп 2025, 12:25 -> 12:36"
Влада Србије усвојила одлуку о повећању минималца од 1. јануара на 551 евро,https://www.rts.rs/vesti/politika/5786620/vlada-srbije-minimalac-odluka.html,"четвртак, 11. сеп 2025, 11:04 -> 20:34"
Оскрнављена капела на приштинском православном гробљу; Министарство културе: Порука мржње према српском народу,https://www.rts.rs/vesti/politika/5786585/oskrnavljena-kapela-na-pristinskom-pravoslavnom-groblju-ministarstvo-kulture-poruka-mrznje-prema-srpskom-narodu.html,"четвртак, 11. сеп 2025, 10:21 -> 14:37"
"Милојевић: Приштина незаконито преузела објекат Поште Србије у Грачаници, борићемо се на суду",https://www.rts.rs/vesti/politika/5786564/milojevic-pristina-nezakonito-preuzela-objekat-poste-srbije-u-gracanici-boricemo-se-na-sudu.html,"четвртак, 11. сеп 2025, 09:25 -> 20:13"
Скуп подршке ректорки Универзитета уметности испред Прекршајног суда у Београду,https://www.rts.rs/vesti/politika/5786608/skup-podrske-prekrsajnog-suda.html,"четвртак, 11. сеп 2025, 10:55 -> 12:08"
"Петковић после трилатералног састанка у Бриселу: Инсистирали смо на ЗСО, а Приштину то не интересује",https://www.rts.rs/vesti/politika/5786556/petkovic-posle-trilateralnog-sastanka-u-briselu-insistirali-smo-na-zso-a-pristinu-to-ne-interesuje.html,"четвртак, 11. сеп 2025, 09:17 -> 11:28"
Графити ,https://www.rts.rs/vesti/politika/5786555/grafiti-uck-u-stanisoru--mestani-uznemireni.html,"четвртак, 11. сеп 2025, 09:01 -> 09:20"
"Петковић допутовао у Брисел, у четвртак ујутру нова рунда дијалога",https://www.rts.rs/vesti/politika/5786435/dijalog-beograd-pristina-brisel.html,"среда, 10. сеп 2025, 21:27 -> 21:38"
Српска листа: Изборни панел одбио нашу жалбу на састав бирачких одбора,https://www.rts.rs/vesti/politika/5786274/srpska-lista-panel-kosovo.html,"среда, 10. сеп 2025, 16:45 -> 19:12"
Мацут са амбасадорком Швајцарске,https://www.rts.rs/vesti/politika/5786267/macut-sa-ambasadorkom-svajcarske.html,"среда, 10. сеп 2025, 16:38 -> 16:48"
Градоначелник Ниша ,https://www.rts.rs/vesti/politika/5786264/gradonacelnik-nisa-preziveo-glasanje-o-nepoverenju.html,"среда, 10. сеп 2025, 16:32 -> 16:46"
Српска листа: Нелегитимни одборници у северној Митровици донели нелегалну одлуку о промени намене земљишта,https://www.rts.rs/vesti/politika/5786016/srpska-lista-nelegitimni-odbornici-u-severnoj-mitrovici-doneli-nelegalnu-odluku-o-promeni-namene-zemljista.html,"среда, 10. сеп 2025, 13:52 -> 14:06"
"Суђење петорици Срба у Приштини, након годину дана проведених у притвору",https://www.rts.rs/vesti/politika/5785943/sudjenje-petorici-srba-u-pristini-nakon-godinu-dana-provedenih-u-pritvoru.html,"среда, 10. сеп 2025, 12:09 -> 18:23"
"Кос позвала на смиривање тензија: Подршка за отварање кластера 3, али су потребни конкртни кораци ",https://www.rts.rs/vesti/politika/5785673/marta-kos-srbija-evropski-parlament.html,"уторак, 09. сеп 2025, 21:09 -> 21:49"
Протести у Чачку и Нишу,https://www.rts.rs/vesti/politika/5785663/protesti-u-cacku-i-nisu.html,"уторак, 09. сеп 2025, 20:47 -> 21:37"
Нова милијарда Приштине за наоружање – Куртијев политички маркетинг или претња миру,https://www.rts.rs/vesti/politika/5785631/nova-milijarda-pristine-za-naoruzanje--kurtijev-politicki-marketing-ili-pretnja-miru.html,"уторак, 09. сеп 2025, 20:00 -> 07:40"
"Вучић: Тражили су санкције против Србије, велики недостатак моралног кредибилитета опозиције",https://www.rts.rs/vesti/politika/5785597/aleksandar-vucic-.html,"уторак, 09. сеп 2025, 18:49 -> 20:58"
Представници дела опозиције затражили у ЕП персонализоване санкције против појединаца у власти Србије,https://www.rts.rs/vesti/politika/5785546/evropski-parlament-strazbur-opozicija-srbija.html,"уторак, 09. сеп 2025, 18:36 -> 18:59"
Упад полиције у просторије ,https://www.rts.rs/vesti/politika/5785580/srpska-lista-sluzbeni-glasnik-upad-policija.html,"уторак, 09. сеп 2025, 17:51 -> 19:36"
"Вучић са Имамуром о јачању економских веза, заједничким пројектима, инвестицијама",https://www.rts.rs/vesti/politika/5785193/vucic-sa-imamurom-o-jacanju-ekonomskih-veza-zajednickim-projektima-investicijama.html,"уторак, 09. сеп 2025, 10:21 -> 10:31"
Беспилотне летелице ,https://www.rts.rs/vesti/politika/5785150/bespilotne-letelice-puma-iz-sad-stigle-na-kim.html,"уторак, 09. сеп 2025, 08:28 -> 08:42"
Кос: Изјаве председника Вучића и председнице парламента Брнабић против ЕУ неће побољшати репутацију Београда,https://www.rts.rs/vesti/politika/5784994/kos-vucic-brnabic-reakcija-.html,"понедељак, 08. сеп 2025, 20:37 -> 10:01"
Нове препреке пред изборе на КиМ – мањак уписаних српских гласача и чланова бирачког одбора,https://www.rts.rs/vesti/politika/5784945/nove-prepreke-pred-izbore-na-kim--manjak-upisanih-srpskih-glasaca-i-clanova-birackog-odbora.html,"понедељак, 08. сеп 2025, 20:00 -> 21:07"
"Дрид: Нађено решење за даљи рад, нема блокаде факултета нити полиције у згради",https://www.rts.rs/vesti/politika/5784934/patrik-drid-dif-blokada-resenje-studenti.html,"понедељак, 08. сеп 2025, 19:01 -> 20:49"
