headline,url,datePublished
Брнабић: Нацрт измена Закона о бирачком списку у складу са препорукама ОДИХР-а,https://www.rts.rs/vesti/politika/5725796/brnabic-nacrt-izmena-zakona-o-birackom-spisku-u-skladu-sa-preporukama-odihr-a.html,"среда, 04. јун 2025, 15:17 -> 19:41"
Вучић с делегацијом ММФ-а о наставку реформи кључних за раст српске привреде,https://www.rts.rs/vesti/politika/5725638/vucic-kjobe-mmf.html,"среда, 04. јун 2025, 14:15 -> 14:45"
,https://www.rts.rs/vesti/politika/5725461/jadar-rio-tinto.html,"среда, 04. јун 2025, 12:56 -> 18:03"
"У Приштини ништа ново, ређају се покушаји конституисања новог сазива парламента",https://www.rts.rs/vesti/politika/5725400/pristina-parlament.html,"среда, 04. јун 2025, 11:59 -> 12:28"
Петковић: Злочини попут убиства Столића у Обилићу не смеју да буду заборављени,https://www.rts.rs/vesti/politika/5725374/stolic-obilic-zlocin.html,"среда, 04. јун 2025, 11:40 -> 11:51"
Протести у Београду и Нишу због претученог студента Правног факултета - ,https://www.rts.rs/vesti/politika/5725432/protesti-u-beogradu-i-nisu-zbog-pretucenog-studenta-pravnog-fakulteta---ovo-nije-niz-incidenata-vec-sistem.html,"среда, 04. јун 2025, 09:38 -> 23:16"
Вучић честитао Лију победу на изборима за председника Јужне Кореје,https://www.rts.rs/vesti/politika/5725308/vucic-cestitka-predsednik-juzna-koreja.html,"среда, 04. јун 2025, 08:42 -> 08:50"
Таковска 10: Куда иде универзитет – факултети између изборних и испитних рокова,https://www.rts.rs/vesti/politika/5725155/takovska-10-studenti-blokada-nastava-ispiti-fakulteti-vanredni-izbori.html,"уторак, 03. јун 2025, 22:10 -> 22:44"
"Вучић: Имаћемо изборе када за то дође време, лаж је да сам икада користио Скај комуникацију",https://www.rts.rs/vesti/politika/5724867/aleksandar-vucic-obracanje.html,"уторак, 03. јун 2025, 18:03 -> 06:17"
"Ана Брнабић са Мартом Кос: Амбициозан, али изводљив план да до краја јула буде отворен Кластер 3",https://www.rts.rs/vesti/politika/5724868/ana-brnabic-sa-martom-kos-ambiciozan-ali-izvodljiv-plan-da-do-kraja-jula-bude-otvoren-klaster-3.html,"уторак, 03. јун 2025, 16:52 -> 19:47"
Мацут: До сада 110 земаља потврдило учешће на ,https://www.rts.rs/vesti/politika/5724731/djuro-macut-ekspo.html,"уторак, 03. јун 2025, 15:52 -> 16:09"
Министар Станковић: Одвојити политику од образовања за решавање кризе на универзитету,https://www.rts.rs/vesti/politika/5724725/dejan-vuk-stankovic-pravni-fakultet-napad-profesorka.html,"уторак, 03. јун 2025, 15:24 -> 15:31"
МУП демантовао тврдње Маринике Тепић,https://www.rts.rs/vesti/politika/5724713/mup-demantovao-tvrdnje-marinike-tepic.html,"уторак, 03. јун 2025, 14:59 -> 16:51"
Петковић после састанка са Соренсеном: Предали смо листу са 50 ескалаторних потеза Приштине,https://www.rts.rs/vesti/politika/5724702/petar-petkovic-dijalog-beograda-i-pristine.html,"уторак, 03. јун 2025, 14:46 -> 19:27"
Вучић се обраћа јавности у 18 часова,https://www.rts.rs/vesti/politika/5724666/vucic-se-obraca-javnosti-u-18-casova.html,"уторак, 03. јун 2025, 13:42 -> 13:48"
Вучић са Троказом: Велику важност придајемо стратешкој сарадњи и пријатељству са Француском,https://www.rts.rs/vesti/politika/5724658/vucic-sa-trokazom-veliku-vaznost-pridajemo-strateskoj-saradnji-i-prijateljstvu-sa-francuskom.html,"уторак, 03. јун 2025, 13:36 -> 13:44"
Амбасадор Лука Гори за РТС: Железнички коридор Београд–Трст визија будућности,https://www.rts.rs/vesti/politika/5724546/luka-gori-italija.html,"уторак, 03. јун 2025, 12:33 -> 13:21"
"Блокада 30 раскрсница у Новом Саду, окупљање код Председништва; Без почетка надокнаде на Медицинском факултету у Београду",https://www.rts.rs/vesti/politika/5724567/blokada-30-raskrsnica-u-novom-sadu-okupljanje-kod-predsednistva-bez-pocetka-nadoknade-na-medicinskom-fakultetu-u-beogradu.html,"уторак, 03. јун 2025, 12:05 -> 20:02"
Марта Кос у Европском парламенту: Излаз из политичке кризе у Србији кроз реформе медијских и изборних закона,https://www.rts.rs/vesti/politika/5724561/marta-kos-srbija-eu-prosirenje.html,"уторак, 03. јун 2025, 11:51 -> 14:09"
"Вучић са Амером Капетановићем о плану раста ЕУ, зеленој транзицији и запошљавању",https://www.rts.rs/vesti/politika/5724541/vucic-amer-kapetanovic.html,"уторак, 03. јун 2025, 11:22 -> 14:33"
Студенти из Пионирског парка одложили штрајк глађу до Видовдана,https://www.rts.rs/vesti/politika/5724486/studenti-pionirski-park-milos-pavlovic.html,"уторак, 03. јун 2025, 10:15 -> 11:05"
"Нова рунда дијалога у Бриселу, Петковић са Соренсеном",https://www.rts.rs/vesti/politika/5724122/dijalog-beograda-i-pristine-petar-petkovic-sorensen.html,"уторак, 03. јун 2025, 05:50 -> 14:04"
Изасланик Троказ у Београду: Српско-француске односе карактерише стратешко партнерство,https://www.rts.rs/vesti/politika/5724353/rene-trokaz-djuric-brnabic.html,"понедељак, 02. јун 2025, 21:35 -> 22:29"
Дан српске дипломатије – осам векова традиције и изазова,https://www.rts.rs/vesti/politika/5724294/dan-srpske-diplomatije-marko-djuric-prijem-.html,"понедељак, 02. јун 2025, 21:00 -> 21:33"
"Избори у Косјерићу – власт, опозиција и руска мањинска странка у борби за 27 одборничких места",https://www.rts.rs/vesti/politika/5724304/lokalni-izbori-kosjeric-glasovi-sns-ruska-stranka-ujedinjeni-kosjeric.html,"понедељак, 02. јун 2025, 20:35 -> 20:40"
Станковић и Маркоски са деканима свих факултета у Новом Саду: Неопходно надокнадити наставу,https://www.rts.rs/vesti/politika/5724145/stankovic-i-markoski-sa-dekanima-svih-fakulteta-u-novom-sadu-neophodno-nadoknaditi-nastavu.html,"понедељак, 02. јун 2025, 16:31 -> 16:50"
 Савет за културу тражи стручно мишљење поводом иницијативе да се жртвама пада надстрешнице подигне споменик,https://www.rts.rs/vesti/politika/5724136/-savet-za-kulturu-trazi-strucno-misljenje-povodom-inicijative-da-se-zrtvama-pada-nadstresnice-podigne-spomenik.html,"понедељак, 02. јун 2025, 16:27 -> 16:44"
Брнабићева позвала Тужилаштво да реагује поводом изјава Маринике Тепић,https://www.rts.rs/vesti/politika/5723880/brnabiceva-pozvala-tuzilastvo-da-reaguje-povodom-izjava-marinike-tepic.html,"понедељак, 02. јун 2025, 13:02 -> 13:34"
"Инцидент на Правном факултету, студент напао професорку и портира ",https://www.rts.rs/vesti/politika/5723847/student-napad-profesorka-pravni-fakultet.html,"понедељак, 02. јун 2025, 12:51 -> 19:49"
"Протест испред Правног факултета у Београду, шетње и скупови у Новом Саду и Нишу",https://www.rts.rs/vesti/politika/5723778/protest-ispred-pravnog-fakulteta-u-beogradu-setnje-i-skupovi-u-novom-sadu-i-nisu.html,"понедељак, 02. јун 2025, 11:31 -> 00:31"
Опозиција тражи да на споменику жртвама пада надстрешнице пише да је за њихову смрт крива корупција,https://www.rts.rs/vesti/politika/5723772/nadstresnica-spomenik-zrtve-opozicija.html,"понедељак, 02. јун 2025, 11:29 -> 12:35"
Пропао и 25. по реду покушај конституисања новог сазива Скупштине у Приштини,https://www.rts.rs/vesti/politika/5723768/pristina-skupstima-kosovo-i-metohija.html,"понедељак, 02. јун 2025, 11:24 -> 11:39"
Мариника Тепић: Србијом влада државни нарко картел на челу са браћом Вучић,https://www.rts.rs/vesti/politika/5723736/marinika-tepic-vucic-kokain-heroin-andrej-kriminal.html,"понедељак, 02. јун 2025, 10:49 -> 12:40"
Вучић замолио студенте који се противе блокадама да не ступају у штрајк глађу,https://www.rts.rs/vesti/politika/5723656/vucic-pavlovic-studenti-20.html,"понедељак, 02. јун 2025, 07:12 -> 15:49"
Додатни рок за 12 кандидатa за чланове Савета РЕМ-а да допуне документацију ,https://www.rts.rs/vesti/politika/5723513/savet-rem-dodatni-rok-kandidati.html,"недеља, 01. јун 2025, 20:00 -> 20:52"
ГГ ,https://www.rts.rs/vesti/politika/5723482/-napad-medijana-predsednik-opstine-osude-dragan-milic.html,"недеља, 01. јун 2025, 16:37 -> 16:59"
Српска листа: У Косовској Митровици фотографисали српску децу и делили им косовске заставе,https://www.rts.rs/vesti/politika/5723417/srpska-lista-u-kosovskoj-mitrovici-fotografisali-srpsku-decu-i-delili-im-kosovske-zastave.html,"недеља, 01. јун 2025, 13:23 -> 13:33"
"Милош Павловић: Сутра састанак са председником, након тога одлука о штрајку глађу",https://www.rts.rs/vesti/politika/5723412/milos-pavlovic-studenti-20.html,"недеља, 01. јун 2025, 12:20 -> 12:42"
"Седам месеци од пада надстрешнице – блокаде Газеле, Бранковог и мостова у Панчеву и Шапцу, одржани скупови широм Србије",https://www.rts.rs/vesti/politika/5723400/sedam-meseci-pad-nadstresnice-protesti-mostovi-blokada-gazela-brankov-pancevo-sabac.html,"недеља, 01. јун 2025, 11:31 -> 08:32"
Вучевић позвао студенте у Пионирском парку да размисле о даљим потезима,https://www.rts.rs/vesti/politika/5723295/vucevic-pionirski-grad-studenti.html,"субота, 31. мај 2025, 21:14 -> 23:42"
"Нападнут председник нишке општине Медијана, нападач спроведен у здравствену установу",https://www.rts.rs/vesti/politika/5723061/opstina-medijana-napad-predsednik-.html,"субота, 31. мај 2025, 15:11 -> 16:02"
Дванаесточасовни студентски и грађански протест у Шапцу – најављене блокаде београдских мостова Бранковог и Газеле,https://www.rts.rs/vesti/politika/5722946/dvanaestocasovni-studentski-i-gradjanski-protest-u-sapcu--najavljene-blokade-beogradskih-mostova-brankovog-i-gazele.html,"субота, 31. мај 2025, 12:15 -> 00:37"
Вучић: Очекујем победу на локалним изборима у Косјерићу наредне недеље,https://www.rts.rs/vesti/politika/5722944/aleksanadar-vucic-poseta-kosjeric.html,"субота, 31. мај 2025, 11:57 -> 19:36"
Локалне власти у Лепосавићу наложиле српским породицама да се иселе из својих кућа,https://www.rts.rs/vesti/politika/5722857/lokalne-vlasti-u-leposavicu-nalozile-srpskim-porodicama-da-se-isele-iz-svojih-kuca.html,"субота, 31. мај 2025, 05:50 -> 19:34"
Реформа јавне управе – три институције из Србије добиле КАФ сертификат ,https://www.rts.rs/vesti/politika/5722785/kaf-sertifikat-reforma-javne-uprave.html,"петак, 30. мај 2025, 21:22 -> 21:52"
Мацут у Новом Пазару о унапређењу инфраструктуре и јачању подршке младима,https://www.rts.rs/vesti/politika/5722747/macut-novi-pazar.html,"петак, 30. мај 2025, 20:05 -> 20:43"
Политичка сцена Србије (не)зрела за изборе – како створити фер услове и ко би био на челу ,https://www.rts.rs/vesti/politika/5722686/politicka-scena-srbije-nezrela-za-izbore--kako-stvoriti-fer-uslove-i-ko-bi-bio-na-celu-ministarstva-za-izbore.html,"петак, 30. мај 2025, 20:00 -> 21:15"
Вучић: Југоимпорт ће направити погон у Зајечару за 350 запослених,https://www.rts.rs/vesti/politika/5722619/vucic-jugoimport-ce-napraviti-pogon-u-zajecaru-za-350-zaposlenih.html,"петак, 30. мај 2025, 16:23 -> 22:41"
Протест студената и грађана ,https://www.rts.rs/vesti/politika/5722212/protest-studenata-i-gradjana-hocemo-izbore-skup-i-u-nisu-stafetni-maraton-do-pozarevca.html,"петак, 30. мај 2025, 12:58 -> 10:09"
Нови ДСС неће на изборе у Косјерићу и Зајечару,https://www.rts.rs/vesti/politika/5722196/novi-dss-nece-na-izbore-u-kosjericu-i-zajecaru.html,"петак, 30. мај 2025, 12:45 -> 13:02"
Полиција у спортској хали у Лепосавићу; Тодић: Међународна заједница немо посматра тихи егзодус на КиМ,https://www.rts.rs/vesti/politika/5721994/srpska-lista-leposavic-sportska-hala.html,"петак, 30. мај 2025, 08:00 -> 09:16"
Скупштински Одбор за културу без посланика опозиције усвојио предлог кандидата за чланове Савета РЕМ-а,https://www.rts.rs/vesti/politika/5721985/savet-rem-odbor-kultura-skupstina-rasprava-konkurs-kandidati.html,"петак, 30. мај 2025, 06:20 -> 17:32"
"Тешки дани на северу КиМ, безбедност Срба горући проблем",https://www.rts.rs/vesti/politika/5721877/sever-kim-bezbednost.html,"четвртак, 29. мај 2025, 20:30 -> 20:59"
"Вучић за РТС:  Жестоки налет Албанаца, гласно ћутање Запада",https://www.rts.rs/vesti/politika/5721872/aleksandar-vucic-rts-kosovo-metohija-republika-srpska-studenti-protesti-blokada-nastava-fakulteti-univerziteti-ekonomija.html,"четвртак, 29. мај 2025, 19:30 -> 21:46"
Одлуке Владе о отварању прелаза ,https://www.rts.rs/vesti/politika/5721827/odluke-vlade-granicni-prelaz-aerodrom-mladi-preduzetnici.html,"четвртак, 29. мај 2025, 17:25 -> 17:31"
Протест у Косовској Митровици; настављају се преговори проректора УБ са студентима у блокади,https://www.rts.rs/vesti/politika/5721366/studenti-protesti-blokade-nadoknada-nastave.html,"четвртак, 29. мај 2025, 17:10 -> 20:52"
Градоначелник Новог Сада упутио иницијативу за израду споменика жртвама пада надстрешнице,https://www.rts.rs/vesti/politika/5721623/inicijativa-spomenik-novi-sad-micin-zrtve-pad-nadstresnica-novi-sad.html,"четвртак, 29. мај 2025, 15:17 -> 15:28"
Локална пошта на КиМ преузима објекат “Поште Србије” у Прилужју,https://www.rts.rs/vesti/politika/5721569/lokalna-posta-na-kim-preuzima-objekat-poste-srbije-u-priluzju.html,"четвртак, 29. мај 2025, 14:45 -> 17:19"
Мемић: Препорука Владе о нерадним данима за Бајрам важан корак ка афирмацији верских права,https://www.rts.rs/vesti/politika/5721481/memic-preporuka-vlade-o-neradnim-danima-za-bajram-vazan-korak-ka-afirmaciji-verskih-prava.html,"четвртак, 29. мај 2025, 13:57 -> 18:12"
Блокада прилазних путева Приштини због либерализације тржишта електричне енергије,https://www.rts.rs/vesti/politika/5721360/pristina-kim.html,"четвртак, 29. мај 2025, 12:30 -> 12:43"
У Приштини пропао и 23. покушај конституисања новог сазива скупштине -  Самоопредељење тражи тајно гласање,https://www.rts.rs/vesti/politika/5721350/u-pristini-propao-i-23-pokusaj-konstituisanja-novog-saziva-skupstine---samoopredeljenje-trazi-tajno-glasanje.html,"четвртак, 29. мај 2025, 12:25 -> 12:37"
Вучић са Хаимбеом о продубљивању сарадње између Србије и Замбије,https://www.rts.rs/vesti/politika/5721269/vucic-sa-haimbeom-o-produbljivanju-saradnje-izmedju-srbije-i-zambije.html,"четвртак, 29. мај 2025, 11:33 -> 14:48"
Вучевић именован за саветника председника Србије за регионална питања,https://www.rts.rs/vesti/politika/5721207/milos-vucevic-.html,"четвртак, 29. мај 2025, 11:07 -> 11:11"
Општина Лепосавић тражи од расељених да се иселе из станова чију је изградњу финансирала Влада Србије,https://www.rts.rs/vesti/politika/5720795/raseljeni-kim-stanovi-leposavic.html,"четвртак, 29. мај 2025, 05:50 -> 06:33"
Вучевић: Скандалозна одлука суда у Новом Саду,https://www.rts.rs/vesti/politika/5720726/milos-vucevic-skandalozna-odluka-sud-novi-sad-pustanje-kucni-pritvor-.html,"среда, 28. мај 2025, 16:58 -> 17:12"
"Лончар на заседању Извршног одбора СЗО, састанак са Тедросом Гебрејесусом",https://www.rts.rs/vesti/politika/5720551/loncar-izvrsni-odbor-szo-tedros-gebrejesus-.html,"среда, 28. мај 2025, 14:15 -> 14:19"
Гојковић у ергели Келебија: Влада Војводине ће подржати пројекте у туристичком сектору,https://www.rts.rs/vesti/politika/5720538/gojkovic-ergela-kelebija-vlada-vojvodine-.html,"среда, 28. мај 2025, 13:51 -> 14:04"
Протест у Лепосавићу због заузимања спортске хале,https://www.rts.rs/vesti/politika/5720414/protest-u-leposavicu-zbog-zauzimanja-sportske-hale.html,"среда, 28. мај 2025, 11:06 -> 16:28"
"Клаудија Тени: Преносим поздраве од Трампа, нада се доласку у Србију; председник Вучић уручио орден америчкој конгресменки",https://www.rts.rs/vesti/politika/5720389/klaudija-teni-prenosim-pozdrave-od-trampa-nada-se-dolasku-u-srbiju-predsednik-vucic-urucio-orden-americkoj-kongresmenki.html,"среда, 28. мај 2025, 10:31 -> 17:21"
"Суђење у Новом Саду – студенткиња препознала окривљеног, активисти СНС-а негирали оптужбе; објављен крај блокаде суда",https://www.rts.rs/vesti/politika/5720343/napad-studenti-blokade-protesti-sudjenje-aktivisti-sns-novi-sad-.html,"среда, 28. мај 2025, 09:47 -> 18:56"
"Брнабић: Стигло 45 кандидатура за РЕМ, Скупштина у јуну о медијским законима",https://www.rts.rs/vesti/politika/5720313/ana-brnabic-rem-skupstina-konkurs-sednica-odbor.html,"среда, 28. мај 2025, 08:36 -> 09:32"
"Николићева о упаду полиције у спортску халу у Лепосавићу:  Ово је постао тренд, један у низу разбојничких чинова",https://www.rts.rs/vesti/politika/5720297/nikoliceva-o-upadu-policije-u-sportsku-halu-u-leposavicu-ovo-je-postao-trend-jedan-u-nizu-razbojnickih-cinova.html,"среда, 28. мај 2025, 08:00 -> 08:32"
Таковска 10: Пола године студентских блокада – између захтева и политике,https://www.rts.rs/vesti/politika/5720153/takovska-10-studenti-protesti-blokade-vanredni-izbori-nastava-fakulteti-univerziteti.html,"уторак, 27. мај 2025, 22:45 -> 23:22"
Настављено суђење четворици Срба са севера КиМ,https://www.rts.rs/vesti/politika/5720091/nastavljeno-sudjenje-cetvorici-srba-sa-severa-kim.html,"уторак, 27. мај 2025, 16:56 -> 17:17"
"Седница о кандидатима за Савет РЕМ-а 30. маја, на списак реагују и власт и опозиција",https://www.rts.rs/vesti/politika/5720086/sednica-savet-rem-narodna-skupstina.html,"уторак, 27. мај 2025, 16:53 -> 20:17"
"Шапић: Плаче ми се, радови у Београду касне због шатора и блокада",https://www.rts.rs/vesti/politika/5720043/aleksandar-sapic-beograd-radovi.html,"уторак, 27. мај 2025, 15:13 -> 18:08"
Вучевић са Боцан-Харченком о ситуацији на КиМ и актуелним међународним питањима,https://www.rts.rs/vesti/politika/5719999/vucevic-sa-bocan-harcenkom-o-situaciji-na-kim-i-aktuelnim-medjunarodnim-pitanjima.html,"уторак, 27. мај 2025, 14:37 -> 14:47"
Полиција упала у халу у Лепосавићу; Петковић: Курти удара на српску децу пред целим  светом,https://www.rts.rs/vesti/politika/5719908/policija-leposavic-kosovo-i-metohija.html,"уторак, 27. мај 2025, 14:01 -> 22:10"
Брнабић: ЗЛФ намерно руши избор чланова РЕМ-а,https://www.rts.rs/vesti/politika/5719885/brnabic-zlf-namerno-rusi-izbor-clanova-rem-a.html,"уторак, 27. мај 2025, 13:14 -> 17:59"
ЗЛФ тражи од Одбора за културу да одбаци кандидатуре петорице кандидата за Савет РЕМ-а,https://www.rts.rs/vesti/politika/5719884/zlf-trazi-od-odbora-za-kulturu-da-odbaci-kandidature-petorice-kandidata-za-savet-rem-a.html,"уторак, 27. мај 2025, 12:58 -> 14:15"
Наставља се серија неуспелих покушаја у формирању новог сазива скупштине у Приштини  ,https://www.rts.rs/vesti/politika/5719834/nastavlja-se-serija-neuspelih-pokusaja-u-formiranju-novog-saziva-skupstine-u-pristini-.html,"уторак, 27. мај 2025, 12:01 -> 12:11"
"Блокада 30 раскрсница у Новом Саду, протестна шетња до полицијске станице у Мајке Јевросиме у Београду",https://www.rts.rs/vesti/politika/5719808/blokada-30-raskrsnica-u-novom-sadu-protestna-setnja-do-policijske-stanice-u-majke-jevrosime-u-beogradu.html,"уторак, 27. мај 2025, 11:40 -> 08:23"
Амбасадор Апостоловић: Србија може да отвори Кластер 3 до краја јула,https://www.rts.rs/vesti/politika/5719733/ambasador-apostolovic-srbija-moze-da-otvori-klaster-3-do-kraja-jula.html,"уторак, 27. мај 2025, 08:52 -> 13:23"
Ситуација у Митровици и даље напета; Срби траже правду за нападнутог матуранта,https://www.rts.rs/vesti/politika/5719616/mitrovica-napad-na-srpskog-maturanta-tenzije-kfor-istraga-pristina.html,"понедељак, 26. мај 2025, 20:00 -> 20:09"
Битка у којој су ,https://www.rts.rs/vesti/politika/5719620/pastrik-bitka-nato-albanija-26-godina-srj.html,"понедељак, 26. мај 2025, 20:00 -> 20:13"
"Вучић: Добар разговор са Додиком, Србија ће увек бити уз Републику Српску",https://www.rts.rs/vesti/politika/5719630/aleksandar-vucic-milorad-dodik.html,"понедељак, 26. мај 2025, 19:34 -> 19:38"
Павловић: Ако сви факултети не почну с радом до 1. јуна крећемо у штрајк глађу,https://www.rts.rs/vesti/politika/5719567/pavlovic-ako-svi-fakulteti-ne-pocnu-s-radom-do-1-juna-krecemo-u-strajk-gladju.html,"понедељак, 26. мај 2025, 18:54 -> 19:55"
